{
  "artifact_id": "artifact_00000000000000000000000000000000",
  "roles": ["native_stdout"],
  "media_type": "application/octet-stream",
  "byte_length": 0,
  "digest": {
    "algorithm": "sha256",
    "value": "e3b0c44298fc1c149afbf4c8996fb92427ae41e4649b934ca495991b7852b855"
  },
  "storage": {
    "uri": "ewb:sha256:e3b0c44298fc1c149afbf4c8996fb92427ae41e4649b934ca495991b7852b855"
  },
  "origin": "process_stdout",
  "capture": { "mode": "raw_stream_capture" },
  "transforms": []
}

